{
  "schema_version": "1.6",
  "profile_id": "tol_standard_dev",
  "dataset_id": "dev-fixtures-v1.6",
  "created_at": "2026-06-06T00:00:00Z",
  "interaction_kind": "hydrogen_bond",
  "ligand_class": "generic",
  "structure_confidence_bin": "high",
  "residue_flexibility_bin": "medium",
  "pocket_depth_bin": "shallow",
  "coordinate_noise_level": "low",
  "radius_tolerance": 0.975,
  "angle_tolerance_deg": 21.0,
  "distance_bin_width": 0.4875,
  "vector_angle_bin_width": 10.5,
  "min_sasa": 0.2067,
  "max_occlusion": 0.51,
  "min_pocket_overlap_score": 0.24,
  "min_rotamer_feasibility_score": 0.4667,
  "max_bucket_occupancy": 128,
  "max_seed_triplets": 4096,
  "max_memory_mb": 32768.0,
  "recall_at_profile": 1.0,
  "hard_negative_rejection": 1.0,
  "hard_negative_false_positive_rate": 0.0,
  "bucket_occupancy_p95": 3.0,
  "peak_memory_mb": 1.0,
  "runtime_ms_per_fixture": 1.0,
  "generated_by_fixture_calibration": true,
  "profile_level": "standard"
}
